Product Name,New Code
Instantbird - New IM tool by the developers of Tor,Anonymity – Tor
What goes on TOR stays on TOR,Anonymity – Tor
Tor2Web Header Info,Anonymity – Tor
"Localbitcoins Cash Deposits, any issues purchasing through tor?",Anonymity – Tor
Tor -> VPN or VPN -> Tor??,Anonymity – Tor
How to Create a Hidden Service Tor WebSite,Anonymity – Tor
Tor on Whonix,Anonymity – Tor
How to be Anonymous Online 2016 with Tor Tails Bitcoin,Anonymity – Tor
Proxychains in Tails (over Tor),Anonymity – Tor
+++TOR SITES LIST 72000+ 2017+++,Anonymity – Tor
How much safer is tails than plain Tor?,Anonymity – Tor
Tor and the Dark Art of Anonimity ,Anonymity – Tor
How to access the Tesco Website through Tor?????? HELP!,Anonymity – Tor
Anonymity:Download files with tor under tails,Anonymity – Tor
Tor and chrome?,Anonymity – Tor
"WTF?! US GOV""T Increases Funding for TOR + $1.8 Million!",Anonymity – Tor
TOR Access the Darknet and Bitcoin How to Get Anonymously,Anonymity – Tor
Tor Remaining Anonymous On The Dark Net 2017,Anonymity – Tor
Chrome Instead of Tor... Bad Idea?,Anonymity – Tor
bookmarking pages into Tor browser a risk?,Anonymity – Tor
Downloading files with Tor,Anonymity – Tor
tor browser error,Anonymity – Tor
TOR Browser Guide for Beginners How to Be Anonymous Online,Anonymity – Tor
Tor and The Dark Net 2016,Anonymity – Tor
TOR Browser Guide for Beginners How to Be Anonymous Online 2016,Anonymity – Tor
TOR Beginners to Expert Guide 2017,Anonymity – Tor
how to access certain websites on Tor?,Anonymity – Tor
Tor check not working?,Anonymity – Tor
Accessing Tor Network using Tails,Anonymity – Tor
Onion Links? Safe-mail?,Anonymity – Tor
WARNING: Browser Security Hole Detected,Anonymity – Tor
"""The NSA wants you to use Tor""",Anonymity – Tor
"New Tor browser bundle (TBB) 3.5.3, Tails 0.23 released today",Anonymity – Tor
TOR User Security Bible,Anonymity – Tor
TOR SITES LIST 72000+ 2017,Anonymity – Tor
Tor - How to be Anonymous Online 2016: Step-by-Step,Anonymity – Tor
Why is tor still overloaded?,Anonymity – Tor
TBB 3.5 - no Vidalia!,Anonymity – Tor
Increase Tor client security by network isolation,Anonymity – Tor
How Not To Get Fucked - A Guide To Buying Illegal Shit On Tor,Anonymity – Tor
Tor Browser Handbook Quick Start Guide 2015,Anonymity – Tor
Transferring Bitcoins through tor,Anonymity – Tor
Long-Term online wallet storage for Tor?,Anonymity – Tor
Tor by itself is not enough - Whats the highest security you can get?,Anonymity – Tor
Iran Blacklists TOR Network,Anonymity – Tor
Is this a safe method of onion browsing,Anonymity – Tor
Tor and the Dark Art of Anonymity How to Be Invisible,Anonymity – Tor
Is TOR compromised?,Anonymity – Tor
How do you make your own site on tor? Like tor hosting and domains ?,Anonymity – Tor
How to configure Pidgin to use TOR ?,Anonymity – Tor
looks like Russia doesn't like TOR,Anonymity – Tor
Important TOR Browser Bundle Security Issue,Anonymity – Tor
"Tor + SSH = Bad Combo (Ops should really read this, too)",Anonymity – Tor
How to update Tor?,Anonymity – Tor
Ultimate Guide to Using Tor privately and anonymously,Anonymity – Tor
Tails+VPN+Tor+Data Encryption?,Anonymity – Tor
Security of .onion sites?,Anonymity – Tor
EXTREME ADVANCED ONION ROUTER,Anonymity – Tor
Tor download(s) problem - FIles maked complete but not done,Anonymity – Tor
VIP72 + TOR on Linux - How to?,Anonymity – Tor
FIREFOX AND TORBROWSER SETUP FOR EXTREME PRIVACY,Anonymity – Tor
What can my Internet provider see when I use TOR?,Anonymity – Tor
TOR May have been compromised,Anonymity – Tor
VOIP over tor?,Anonymity – Tor
Tor not as Anonymous as you think?,Anonymity – Tor
"Tor -> socks5, paypal",Anonymity – Tor
Tor not ready?,Anonymity – Tor
Exit nodes,Anonymity – Tor
Tor Developer Suspects NSA Interception of Amazon Purchase,Anonymity – Tor
Jabber over Tor,Anonymity – Tor
how LE tries to de-anonymize TOR users,Anonymity – Tor
Keeping your Tor Browser Bundle Updated & Yourself Safe(Newbies READ),Anonymity – Tor
Tor or Clearnet,Anonymity – Tor
How Do I Use Tor Over RDP?,Anonymity – Tor
TOR Browser looking a bit different when you open?,Anonymity – Tor
Update Tor Browser?,Anonymity – Tor
would Tor exit node work with pp?,Anonymity – Tor
How to setup ICQ trough tor?,Anonymity – Tor
HOW NOT TO GET FUCKED - A QUICKSTART GUIDE TO BUYING ILLEGAL SHIT ON TOR,Anonymity – Tor
Tor Project - TAILS for Dummies!,Anonymity – Tor
How do you add a Vpn on top of TOR (USA),Anonymity – Tor
Easy TOR & PGP Guide 4096 RSA,Anonymity – Tor
Is it possible for LE to setup their own Tor bridges??,Anonymity – Tor
New Tor-Browser-Package tor-browser-2.3.25-14_en-US Corrupted?,Anonymity – Tor
Torbox?,Anonymity – Tor
When your torbrowser starts acting funny with www preceding onion url,Anonymity – Tor
Password manager for Tor?,Anonymity – Tor
Tor: Hidden Service Protocol & How to configuring Hidden Services,Anonymity – Tor
"A guide to XMPP, Off-the-Record, and basic chat client configuration with Tor",Anonymity – Tor
using tor with a smartphone,Anonymity – Tor
Chaining a Socks5 With Tor TUTORIAL,Anonymity – Tor
Tor and the Dark Art of Anonimity,Anonymity – Tor
TOR Middlebox Routing VB VM Traffic Over The TOR Network,Anonymity – Tor
TOR BROWSER UPDATE!,Anonymity – Tor
Why is browsing clearnet with Tor a security risk?,Anonymity – Tor
Massive use of TOR...,Anonymity – Tor
ANDROID SECURITY PRIVACY + ENCRYPTION PACK,Anonymity – Tor
Tor trojan detected,Anonymity – Tor
TOR SECURITY ANONYMOUSLY GUIDE A MUST-READ UTILITY GUIDE,Anonymity – Tor
Tor and the Dark Art of Anonymity How to Be Invisible from NSA,Anonymity – Tor
I am currently using a yahoo email over TOR as my darknet email - bad?,Anonymity – Tor
How to be Anonymous Online 2016 with Tor Tails Bitcoin and Writeprints 2016,Anonymity – Tor
FIREFOX AND TOR BROWSER SETUP FOR EXTREME PRIVACY,Anonymity – Tor
DIY Tor Wireless access point,Anonymity – Tor
Tor question,Anonymity – Tor
New TOR Service - Alternative to PGP - Encrypted Anonymous Messaging,Anonymity – Tor
Is It Possible To Access Tor On Public Wifis?,Anonymity – Tor
"The term ""TOR stand alone""",Anonymity – Tor
UNOFFICIAL GUIDE TO TOR  REALLY PRIVATE BROWSING ,Anonymity – Tor
Tor Configuration settings.Tor is not enough Now Configure ,Anonymity – Tor
Stay safe with tor MUST HAVE,Anonymity – Tor
"UNOFFICIAL GUIDE TO TOR, REALLY PRIVATE BROWSING",Anonymity – Tor
How Do You Get Torchat To work?,Anonymity – Tor
0,0
