Product Name,New Code
Is this a 99% safe way of purchasing illegal drugs from over seas?,Drugs – General
Magic Mushrooms of Australia and New Zealand,Drugs – General
Drug Tutorials (Dmt,Drugs – General
Neurochemistry of Abused Drugs,Drugs – General
Marijuana 101: Professor Lee's Introduction to Growing Grade A Bud,Drugs – General
Newbie help! Basic setup for just buying drugs,Drugs – General
"Drugs The Straight Facts, Alcohol",Drugs – General
Getting High: Marijuana through the Ages,Drugs – General
Drugs 2.0: The Web Revolution That's Changing How the,Drugs – General
HOW TO SELL DRUGS,Drugs – General
A Guidebook to the Psilocybin Mushrooms of Mexico (1976) - Big D. Unlimited,Drugs – General
LSD - Otto Snow,Drugs – General
Follow The Bitcoins: How We Got Busted Buying Drugs On Silk Road's,Drugs – General
fentanyl roxys But look exactly like A215s,Drugs – General
"HOW TO USE CANNABIS ROAD AS A BUYER 2 (FINDING PRODUCTS, VENDORS, SHOPPING CART)",Drugs – General
"Drugs The Straight Facts, Barbiturates",Drugs – General
Drugs The Straight Facts - Diet Pills,Drugs – General
A Chemical Love Story Almost Free (buy 1 get 1 free),Drugs – General
DMT The Spirit Molecule - Rick Strassman,Drugs – General
A Guidebook to the Psilocybin Mushrooms of Mexico,Drugs – General
Drugs The Straight Facts - Designer Drugs,Drugs – General
Marijuana Business: How to Open and Successfully Run a Marijuana Dispensary and Grow Facility,Drugs – General
Drugs The Straight Facts - Ritalin and Other Methylphenidate,Drugs – General
How To Clean Up Those Drugs!!!!,Drugs – General
"How-To Hydroponics, Third Edition",Drugs – General
"Drugs The Straight Facts, Date Rape Drugs",Drugs – General
How-To Hydroponics,Drugs – General
Drugs The Straight Facts - Ecstasy,Drugs – General
HOW TO SUCCESSFULLY PASS A DRUG TEST    ,Drugs – General
"Acid Dreams: The Complete Social History of LSD: The CIA, the Sixties, and Beyond",Drugs – General
Cannabinoids as Therapeutics,Drugs – General
CANNABIS GUIDES PACK,Drugs – General
aussie dmt sellers?,Drugs – General
"LSD My Problem Child: Reflections on Sacred Drugs, Mysticism",Drugs – General
Alcohol (Drugs: The Straight Facts),Drugs – General
Drug Megapack (MDMA,Drugs – General
Drugs The Straight Facts - Inhalants,Drugs – General
Chances of CD on small amounts of MDMA?,Drugs – General
Taking prescription drugs into US,Drugs – General
The Great BIG Narcotics Cookbook,Drugs – General
Need help with drug order...,Drugs – General
Cannabis Alchemy - D. Gold,Drugs – General
Drugs The Straight Facts,Drugs – General
Marijuana Chemistry: Genetics,Drugs – General
Marijuana possession.,Drugs – General
"HOW TO USE CANNABIS ROAD AS A BUYER 1 (TOUR, MESSAGING, BASIC PGP INFO, WALLET)",Drugs – General
Medical Marijuana Books and Magazines,Drugs – General
10g Mephedrone,Drugs – General
Drugs The Straight Facts - Anti-Depressants,Drugs – General
? DRUG INDEX ?,Drugs – General
"Aprendiendo de las drogas[mdma, opio, hongos, cannabis, cocaina, cafe, alcohol]-Escohotado (buy 1 ge",Drugs – General
[GUIDE] Create Verifiable Marijuana Recommendations BUY WEED LEGALLY!!,Drugs – General
Jesse Venturas Marijuana Manifesto 2016,Drugs – General
Reputable and Trusted Canadian vendor of high grade medical marijuana ,Drugs – General
"Drug Tutorials (Dmt, Cocaine, Heroin, Mdma, Meth)(Clone)",Drugs – General
Buyer's and Vendor's Guide To Internet Drug Dealing/Buying,Drugs – General
HOW TO PASS A DRUG TEST,Drugs – General
HOW TO PASS A DRUG TEST ,Drugs – General
Methods to stop Police helicopters picking up infared light from grows,Drugs – General
Friend's friend got busted for ordering 25g of weed from SR,Drugs – General
Acid Dreams.The Complete Social History of LSD_ The CIA,Drugs – General
HOW TO PASS A DRUG TEST  ,Drugs – General
Drugs the Straight Facts - Codeine,Drugs – General
"Want CHEAP Guides? (Free Electricity, drugs? :)) ONLY $1",Drugs – General
1 Guide to Safely dosing 25i-NBOMe    2016   ,Drugs – General
Get Drugs saftest way.. though world wide order,Drugs – General
What role does Vitamin C play when used with an ecstasy trip?,Drugs – General
Psilocybin Mushroom Handbook,Drugs – General
Cocaine Handbook: An Essential Reference,Drugs – General
Cautions for weed,Drugs – General
Drugs The Straight Facts - Heroin,Drugs – General
"Acid Dreams.The Complete Social History of LSD_ The CIA, The Sixties Almost Free (buy 1 get 1 free)",Drugs – General
$40/eigth Cubensis Mushrooms [USA to USA] ,Drugs – General
Drops for buying drugs,Drugs – General
Psychedelic Drugs Reconsidered,Drugs – General
Drugs The Straight Facts - Body Enhancement Products,Drugs – General
Drugs The Straight Facts Alzheimer's Disease and Memory,Drugs – General
Psilocybin Producers Guide,Drugs – General
THE PSYCHEDELIC EXPLORER'S GUIDE - James Fadiman PH.D [PDF] instant auto-delivery LSD DMT PSILOCYBIN,Drugs – General
♕ CANNABIS GUIDES PACK ♕,Drugs – General
Recreational Drugs - Proffessor Buzz,Drugs – General
best LSD trips,Drugs – General
"Drug Abuse Handbook, 2nd Ed",Drugs – General
CANNABIS GUIDES PACK  ,Drugs – General
"A guy in Fresno, CA got indicted on drug charge.",Drugs – General
How would one send cocaine to a lab for tests?,Drugs – General
1 Guide to Safely dosing 25i-NBOMe ***2016***,Drugs – General
Drugs The Straight Facts - Prescription Pain Relievers,Drugs – General
A Field Guide to Mushrooms,Drugs – General
Drugs The Straight Facts - Opium,Drugs – General
Acid Dreams: The Complete Social History of LSD: The CIA,Drugs – General
Sneaking MDMA into a gig - advice,Drugs – General
Drugs The Straight Facts - Marijuana,Drugs – General
A Guidebook To The Psilocybin Mushrooms Of Mexico,Drugs – General
LSD - Complete Fbi Blotter Microgram Analysis Manual (1987)Almost Free,Drugs – General
Psychedelics: The Uses and Implications of Hallucinogenic Dr,Drugs – General
"Drugs, The Straight Facts (Complete Series)",Drugs – General
hide lsd trips at the airport,Drugs – General
Ayahuasca Analoge-Ott Almost Free,Drugs – General
Psilocybin Producer's Guide,Drugs – General
Drugs The Straight Facts - Date Rape Drugs,Drugs – General
How to Get High Off Your Marijuana Twice (Weed Secrets),Drugs – General
"Drug Abuse Handbook, Second Edition",Drugs – General
The Medical Cannabis Guidebook The Definitive Guide 2014,Drugs – General
HOW TO SUCCESSFULLY PASS A DRUG TEST ,Drugs – General
"Drugs, addiction, and the brain [2014]",Drugs – General
Marijuana A Reference Handbook 2nd edition 2017,Drugs – General
Drugs of Abuse in the Future Almost free,Drugs – General
"Drugs The Straight Facts, Anti-Anxiety Drugs",Drugs – General
Drugs The Straight Facts - Alcohol,Drugs – General
Drugs the Straight Facts - Sleep Aids,Drugs – General
Drugs The Straight Facts - Nicotine,Drugs – General
HOW TO SELL DRUGS  ,Drugs – General
"LSD, my Problem Child (with pics)-Hofmann Almost free",Drugs – General
Ricin questions,Drugs – General
Edible And Poisonous Mushrooms Of The World,Drugs – General
Cannabis Alchemy: The Art of Modern Hashmaking,Drugs – General
"Drugs The Straight Facts, Antidepressants",Drugs – General
Marijuana Smoker's Guidebook: The Easy Way to Identify and Enjoy Marijuana Strains,Drugs – General
Drugs 2.0 The Web Revolution That's Changing How the World,Drugs – General
"Drug Megapack (MDMA, Speed, Cocaine, DMT, etc)",Drugs – General
Ordering 4+ ounces of weed,Drugs – General
The great BIG Narcotics Cookbook,Drugs – General
LSD My Problem Child: Reflections on Sacred Drugs,Drugs – General
Drug Abuse Handbook,Drugs – General
Drugs The Straight Facts - Cocaine,Drugs – General
Drugs The Straight Facts - Hallucinogens,Drugs – General
Drugs the Straight Facts - Morphine,Drugs – General
"Nitrous Oxide, Become your own nitrous mafia :)",Drugs – General
43 Books on Psilocybin Mushrooms,Drugs – General
Are the odds of LSD being intercepted (EUtoUS) lower than most drugs?,Drugs – General
Aprendiendo de las drogas[mdma,Drugs – General
Magic Mushrooms Around the World: A Scientific Journey Across Cultures and Time - The Case for Challenging Research and Value Systems,Drugs – General
♕ DMT: The Spirit Molecule ♕,Drugs – General
Glassware: where to find it.,Drugs – General
Psilocybin Magic Mushroom Grower's Guide,Drugs – General
DRUGS SUPER PACK OF BOOKS,Drugs – General
best product to wash MBB,Drugs – General
Psilocybe Cubensis Ebook Pack,Drugs – General
0,0
