Product Name,New Code
? DRUG INDEX ?,Drugs – General
HOW TO PASS A DRUG TEST ,Drugs – General
HOW TO SUCCESSFULLY PASS A DRUG TEST ,Drugs – General
♕ CANNABIS GUIDES PACK ♕,Drugs – General
♕ DMT: The Spirit Molecule ♕,Drugs – General
♕ HOW TO SELL DRUGS ♕,Drugs – General
1 Guide to Safely dosing 25i-NBOMe ***2016***,Drugs – General
12 Delicious Marijuana Recipes,Drugs – General
43 Books on Psilocybin Mushrooms,Drugs – General
A Chemical Love Story Almost Free (buy 1 get 1 free),Drugs – General
A Field Guide to Mushrooms,Drugs – General
A Guidebook To The Psilocybin Mushrooms Of Mexico,Drugs – General
A Guidebook to the Psilocybin Mushrooms of Mexico,Drugs – General
A Guidebook to the Psilocybin Mushrooms of Mexico (1976) - Big D. Unlimited,Drugs – General
"Acid Dreams: The Complete Social History of LSD: The CIA, the Sixties, and Beyond",Drugs – General
"Acid Dreams.The Complete Social History of LSD_ The CIA, The Sixties Almost Free (buy 1 get 1 free)",Drugs – General
Alcohol (Drugs: The Straight Facts),Drugs – General
Amphetamine Syntheses: Overview & Reference Guide for Professionals,Drugs – General
"Aprendiendo de las drogas[mdma, opio, hongos, cannabis, cocaina, cafe, alcohol]-Escohotado (buy 1 ge",Drugs – General
Ayahuasca Analoge-Ott Almost Free,Drugs – General
Cannabinoids as Therapeutics,Drugs – General
Cannabis Alchemy - D. Gold,Drugs – General
Cannabis Alchemy: The Art of Modern Hashmaking,Drugs – General
CANNABIS SUPER PACK OF BOOKS,Drugs – General
Cocaine Handbook: An Essential Reference,Drugs – General
DMT The Spirit Molecule - Rick Strassman,Drugs – General
DMT: The Spirit Molecule: A Doctor's Revolutionary Research into the Biology of Near-Death and Mystical Experiences,Drugs – General
"Drug Abuse Handbook, 2nd Ed",Drugs – General
"Drug Abuse Handbook, Second Edition",Drugs – General
"Drug Megapack (MDMA, Speed, Cocaine, DMT, etc)",Drugs – General
"Drug Tutorials (Dmt, Cocaine, Heroin, Mdma, Meth)(Clone)",Drugs – General
Drugs 2.0 The Web Revolution That's Changing How the World,Drugs – General
Drugs 2.0: The Web Revolution That's Changing How the,Drugs – General
Drugs of Abuse in the Future Almost free,Drugs – General
DRUGS SUPER PACK OF BOOKS,Drugs – General
Drugs The Straight Facts - Alcohol,Drugs – General
Drugs The Straight Facts - Anti-Depressants,Drugs – General
Drugs The Straight Facts - Body Enhancement Products,Drugs – General
Drugs The Straight Facts - Cocaine,Drugs – General
Drugs the Straight Facts - Codeine,Drugs – General
Drugs The Straight Facts - Date Rape Drugs,Drugs – General
Drugs The Straight Facts - Designer Drugs,Drugs – General
Drugs The Straight Facts - Diet Pills,Drugs – General
Drugs The Straight Facts - Ecstasy,Drugs – General
Drugs The Straight Facts - Hallucinogens,Drugs – General
Drugs The Straight Facts - Heroin,Drugs – General
Drugs The Straight Facts - Inhalants,Drugs – General
Drugs The Straight Facts - Marijuana,Drugs – General
Drugs the Straight Facts - Morphine,Drugs – General
Drugs The Straight Facts - Nicotine,Drugs – General
Drugs The Straight Facts - Opium,Drugs – General
Drugs The Straight Facts - Prescription Pain Relievers,Drugs – General
Drugs The Straight Facts - Ritalin and Other Methylphenidate,Drugs – General
Drugs the Straight Facts - Sleep Aids,Drugs – General
Drugs The Straight Facts Alzheimer's Disease and Memory,Drugs – General
"Drugs The Straight Facts, Alcohol",Drugs – General
"Drugs The Straight Facts, Anti-Anxiety Drugs",Drugs – General
"Drugs The Straight Facts, Antidepressants",Drugs – General
"Drugs The Straight Facts, Barbiturates",Drugs – General
"Drugs The Straight Facts, Date Rape Drugs",Drugs – General
"Drugs, addiction, and the brain [2014]",Drugs – General
"Drugs, The Straight Facts (Complete Series)",Drugs – General
Edible And Poisonous Mushrooms Of The World,Drugs – General
Getting High: Marijuana through the Ages,Drugs – General
How to Get High Off Your Marijuana Twice (Weed Secrets),Drugs – General
How to Get High Off Your Weed Twice (Marijuana Secrets),Drugs – General
How to Smoke Pot Properly A Highbrow Guide to Getting High,Drugs – General
Jesse Venturas Marijuana Manifesto 2016,Drugs – General
LSD - Complete Fbi Blotter Microgram Analysis Manual (1987)Almost Free,Drugs – General
LSD - Otto Snow,Drugs – General
"LSD My Problem Child: Reflections on Sacred Drugs, Mysticism",Drugs – General
LSD Psychotherapy,Drugs – General
"LSD, my Problem Child (with pics)-Hofmann Almost free",Drugs – General
Magic Mushrooms Around the World: A Scientific Journey Across Cultures and Time - The Case for Challenging Research and Value Systems,Drugs – General
Marijuana A Reference Handbook 2nd edition 2017,Drugs – General
Marijuana Business: How to Open and Successfully Run a Marijuana Dispensary and Grow Facility,Drugs – General
"Marijuana Chemistry: Genetics, Processing, Potency 2nd Edition",Drugs – General
Marijuana Smoker's Guidebook: The Easy Way to Identify and Enjoy Marijuana Strains,Drugs – General
Medical Marijuana Books and Magazines,Drugs – General
Neurochemistry of Abused Drugs,Drugs – General
Psilocybe Cubensis Ebook Pack,Drugs – General
Psilocybin Magic Mushroom Grower's Guide,Drugs – General
Psilocybin Mushroom Handbook,Drugs – General
Psilocybin Mushrooms of the World,Drugs – General
Psychedelic Drugs Reconsidered,Drugs – General
Psychedelics: The Uses and Implications of Hallucinogenic Dr,Drugs – General
Recreational Drugs - Proffessor Buzz,Drugs – General
The Medical Cannabis Guidebook The Definitive Guide 2014,Drugs – General
THE PSYCHEDELIC EXPLORER'S GUIDE - James Fadiman PH.D [PDF] instant auto-delivery LSD DMT PSILOCYBIN,Drugs – General
10g Mephedrone,Drugs – General
"A guy in Fresno, CA got indicted on drug charge.",Drugs – General
Buyer's and Vendor's Guide To Internet Drug Dealing/Buying,Drugs – General
fentanyl roxys But look exactly like A215s,Drugs – General
Get Drugs saftest way.. though world wide order,Drugs – General
How To Clean Up Those Drugs!!!!,Drugs – General
Is this a 99% safe way of purchasing illegal drugs from over seas?,Drugs – General
Are the odds of LSD being intercepted (EUtoUS) lower than most drugs?,Drugs – General
How would one send cocaine to a lab for tests?,Drugs – General
Drops for buying drugs,Drugs – General
Cautions for weed,Drugs – General
Marijuana possession.,Drugs – General
best product to wash MBB,Drugs – General
reselling drugs on instagram,Drugs – General
Ordering 4+ ounces of weed,Drugs – General
Drug Abuse Handbook,Drugs – General
HOW TO SELL DRUGS,Drugs – General
Drugs The Straight Facts,Drugs – General
CANNABIS GUIDES PACK,Drugs – General
Marijuana Chemistry: Genetics,Drugs – General
DMT: The Spirit Molecule  ,Drugs – General
CANNABIS GUIDES PACK  ,Drugs – General
HOW TO PASS A DRUG TEST,Drugs – General
Drug Tutorials (Dmt,Drugs – General
1 Guide to Safely dosing 25i-NBOMe    2016   ,Drugs – General
HOW TO SUCCESSFULLY PASS A DRUG TEST    ,Drugs – General
HOW TO PASS A DRUG TEST  ,Drugs – General
LSD My Problem Child: Reflections on Sacred Drugs,Drugs – General
HOW TO SELL DRUGS  ,Drugs – General
Acid Dreams: The Complete Social History of LSD: The CIA,Drugs – General
Acid Dreams.The Complete Social History of LSD_ The CIA,Drugs – General
Drug Megapack (MDMA,Drugs – General
Aprendiendo de las drogas[mdma,Drugs – General
Grade AAAA buds from top trusted vendor,Drugs – General
Reputable and Trusted Canadian vendor of high grade medical marijuana ,Drugs – General
$40/eigth Cubensis Mushrooms [USA to USA] ,Drugs – General
OPSEC Lessons from Xanax King & Reddit (clearnet) Link,Drugs – General
Glassware: where to find it.,Drugs – General
What role does Vitamin C play when used with an ecstasy trip?,Drugs – General
Ricin questions,Drugs – General
Methods to stop Police helicopters picking up infared light from grows,Drugs – General
Friend's friend got busted for ordering 25g of weed from SR,Drugs – General
hide lsd trips at the airport,Drugs – General
Taking prescription drugs into US,Drugs – General
aussie dmt sellers?,Drugs – General
Follow The Bitcoins: How We Got Busted Buying Drugs On Silk Road's,Drugs – General
Chances of CD on small amounts of MDMA?,Drugs – General
"HOW TO USE CANNABIS ROAD AS A BUYER 2 (FINDING PRODUCTS, VENDORS, SHOPPING CART)",Drugs – General
"HOW TO USE CANNABIS ROAD AS A BUYER 1 (TOUR, MESSAGING, BASIC PGP INFO, WALLET)",Drugs – General
best LSD trips,Drugs – General
Need help with drug order...,Drugs – General
"Nitrous Oxide, Become your own nitrous mafia :)",Drugs – General
Newbie help! Basic setup for just buying drugs,Drugs – General
Sneaking MDMA into a gig - advice,Drugs – General
[GUIDE] Create Verifiable Marijuana Recommendations BUY WEED LEGALLY!!,Drugs – General
"Want CHEAP Guides? (Free Electricity, drugs? :)) ONLY $1",Drugs – General
Magic Mushrooms of Australia and New Zealand,Drugs – General
Guide to dealing,Drugs – General
Acid Dreams: The Complete Social History of LSD,Drugs – General
"Acid Dreams: The Complete Social History of LSD: The CIA, th",Drugs – General
Beginners Guide To Dealing Drugs,Drugs – General
The Official High Times Cannabis Cookbook,Drugs – General
Hallucinogenic Plants - A Golden Guide,Drugs – General
Hallucinogens and Culture,Drugs – General
Hallucinogens And Shamanism,Drugs – General
Getting High Marijuana through the Ages 2016,Drugs – General
Peyote and Mescaline (Drugs: The Straight Facts),Drugs – General
Peyote and other Psychoactive Cacti,Drugs – General
Essential Psychedelic Guide,Drugs – General
Weed The User's Guide 2016,Drugs – General
Salvinorin: The Psychedelic Essence of Salvia Divinorum,Drugs – General
The Encyclopedia of Addictive Drugs,Drugs – General
The Essential Psychedelic Guide,Drugs – General
How to Import Wine !,Drugs – General
HOW TO SUCCESSFULLY PASS A DRUG TEST,Drugs – General
Ordering Weed,Drugs – General
5 UK Men Charged With Drug Offenses on Dark Web Forums,Drugs – General
"As Cannabis moves into a legas status in the US, how shold it be regulated?",Drugs – General
"BBC:  War on illegal drugs failing, medical researchers warn",Drugs – General
Best place for psychedelic therapy ?,Drugs – General
Countries where some drugs are legal,Drugs – General
Drops For Beginners: Why You May Or May Not Want To Use One?,Drugs – General
DRUG AND MEDICINE STORE,Drugs – General
DRUG POLICY REFORM,Drugs – General
SniperFox's SniperStore - Guides - Autoshop Invites - Flake Cocaine,Drugs – General
UK - DRUG Laws and Police procedure,Drugs – General
US May Be Turning the Corner on Drug Law,Drugs – General
weed,Drugs – General
Silk Road drug dealer pleads guilty (Digitalink),Drugs – General
Are research chemicals legal?,Drugs – General
Flying With Drugs,Drugs – General
[[ T5 ]] NBOME VENDOR // LEGIT?!,Drugs – General
[Intel] Entrapment - Strategies for Prosecuting Drug cases,Drugs – General
"Possesion of an 8 Ball of MDMA, Best Legal Advice?",Drugs – General
Doing drugs on camera and claiming they aren't drugs,Drugs – General
Why are people not so cautious when talking about their drug habits?,Drugs – General
The Psilocybin Mushroom Image Guide,Drugs – General
The Psilocybin Solution,Drugs – General
undercover drugs police huddersfield,Drugs – General
Safest drugs to send ?,Drugs – General
0,0
