Product Name,New Code
How To Make LSD  ,Drugs – Production
"COCAINE , THE COMPLETE CULTIVATION AND SYNTESIS",Drugs – Production
How To Make Amphetamine (SPEED)  ,Drugs – Production
DMT Extraction Guide,Drugs – Production
The Complete Cannabis Cultivator,Drugs – Production
Uncle Fester - Practical LSD Manufacture,Drugs – Production
MDMA Sythesis complete guide. Make your own mdma at home!,Drugs – Production
How To Make LSD,Drugs – Production
Marijuana Growing Ebook Collection,Drugs – Production
The Great BIG Narcotics Cookbook,Drugs – Production
The Cannabis Grow Bible E-book,Drugs – Production
Growing Elite Marijuana - The Complete Guide,Drugs – Production
Drug Making Tutorials: LSD,Drugs – Production
"Drug Making Tutorials: LSD, Cocaine, Meth, Heroin, and More!",Drugs – Production
The Cannabis Breeders Bible The Definitive Guide 2005,Drugs – Production
Amphetamine Synthesis Gold Pack with Pictures,Drugs – Production
eBook - The Marijuana Growers Guide,Drugs – Production
Contemporary Drug Synthesis,Drugs – Production
An Advanced Laboratory Manual Of Organic Chemistry,Drugs – Production
How to Cook Meth at Home 2017,Drugs – Production
Magic Mushroom Grower's Guide,Drugs – Production
How to extract cocaine from Paper or Paperboard,Drugs – Production
DRUGS SYNTHESIS COMPLETE | cookbooks  ,Drugs – Production
Beginner's Guide To Making HEROIN,Drugs – Production
Marijuana Horticulture: The Indoor/Outdoor Medical Grower's,Drugs – Production
Bootleg Your Own Moonshine At Home [DW014],Drugs – Production
HOW TO MAKE MDMA FULL GUIDE (A-Z)GUIDE,Drugs – Production
Secrets of Meth Manufacture 8th Edition,Drugs – Production
Amphetamine Synthesis - Otto Snow,Drugs – Production
HOW TO MAKE GHB,Drugs – Production
⭐HOW TO CLEAN & WASH IMPURTIES FROM ANY DRUG,Drugs – Production
How To Grow Magic Mushrooms,Drugs – Production
How to Make MDMA [WITH PICTURES],Drugs – Production
Grow Marijuana Now!: An Introductory  Step-by-Step Guide to Growing Cannabis  ,Drugs – Production
Marijuana Buds for Less: Grow 8 oz. of Bud for Less Than $10,Drugs – Production
[NOW Â£1.00!] Producing your own Steroids - HUGE PROFIT (VOUCHED),Drugs – Production
BANNED eBooks: Meth Secrets,Drugs – Production
PSYCHEDELIC MUSHROOMS GROWING GUIDE PACK  ,Drugs – Production
HOW TO MAKE DRUGS GIGAPACK ALL DRUG MAKING  2017,Drugs – Production
Indoor Mushroom Growing Technique For Boil A Bag,Drugs – Production
How To Make Cocaine,Drugs – Production
One Pot Shake and Bake Meth Cooking,Drugs – Production
Do It Yourself - How To Make Hash Oil,Drugs – Production
How to Make Speed [WITH PHOTOS],Drugs – Production
HOW TO MAKE ALL DRUGS  + BONUS !,Drugs – Production
Make Cheap Drugs at Home (Guide for 17 Most Popular Drugs),Drugs – Production
Self Written LSD Synthesis  By Dr.Chemist,Drugs – Production
How To Make MDMA,Drugs – Production
The Mushroom Cultivator: A Practical Guide to Growing Mushro,Drugs – Production
Amphetamine Synthesis - Very Easy With Photos,Drugs – Production
♕ How To Make Cocaine ♕,Drugs – Production
How To Make Alcohol,Drugs – Production
How To Make Amphetamine  (Speed),Drugs – Production
How To Make DMT,Drugs – Production
*How to Make Heroin at Home*,Drugs – Production
PSYCHEDELIC MUSHROOMS GROWING GUIDE PACK ,Drugs – Production
HOW TO MAKE DMT  ,Drugs – Production
Make MDMA at Home Guide,Drugs – Production
How To Make Cocaine  ,Drugs – Production
The Art And Science Of Cooking With Cannabis,Drugs – Production
"Guides to Making MDA, Heroin, Ecstasy, Meth & More!!",Drugs – Production
The Great Big Narcotics Cookbook  ,Drugs – Production
The Great Big Narcotics Cookbook,Drugs – Production
How to Make Amphetamine WITH PHOTOS,Drugs – Production
⭐HOW TO MAKE MDMA FULL GUIDE (A-Z)GUIDE,Drugs – Production
♕ How To Make Amphetamine (SPEED) ♕,Drugs – Production
Psilocybin Mushroom Handbook,Drugs – Production
How To Make Cocaine [Fast Shipping},Drugs – Production
How to make Alcohol?,Drugs – Production
Earn Money Growing Mushrooms Easily [DW012],Drugs – Production
HOW TO MAKE HEROIN  ,Drugs – Production
HOW TO CLEAN & WASH IMPURTIES FROM ANY DRUG,Drugs – Production
Total Synthesis II How To Make MDMA 2017,Drugs – Production
MDMA How To Make It,Drugs – Production
A Complete MDMA Synthesis for The First Time Chemist,Drugs – Production
Closet Culture Cannabis Growing Guide,Drugs – Production
How to Grow Practically Everything,Drugs – Production
How to make alcohol,Drugs – Production
HOW TO MAKE MDMA  ,Drugs – Production
Amphetamine Synthesis-Sources-Easy(with pics)with SOURCES,Drugs – Production
"Brewers' Recipes - Beers, Wines & Spirits",Drugs – Production
The Ultimate Beginner's Guide to Making LSD 2017,Drugs – Production
♔ Organic Chemistry Laboratory Survival Manual eBook ♔,Drugs – Production
Clandestine Drug Chemist Pack,Drugs – Production
Uncle fester - Secrets of Methamphetamine Manufacture 8th,Drugs – Production
complete step by step tutorial on how to make home made MDMA.,Drugs – Production
✔ ⟁ The Great BIG Narcotics Cookbook ⟁ (͠≖ ͜ʖ͠≖),Drugs – Production
How To Make Heroin [WITH PHOTOS],Drugs – Production
How To Make LSD [WITH PHOTOS],Drugs – Production
How To Make Drugs (Tutorials Pack),Drugs – Production
Otto Snow collection Amphetamine syntheses etc.,Drugs – Production
EASY HOW TO MAKE MDMA AT HOME GUIDE WITH PICS,Drugs – Production
♔ MDMA Synthesis Instructional Guide eBook ♔,Drugs – Production
mdma synthesis for beginners,Drugs – Production
How To Grow Cannabis (Over 50 books) Complete Guide,Drugs – Production
Marijuana 101: Professor Lee's Introduction to Growing Grade A Bud,Drugs – Production
Beginners Guide to Growing Marijuana,Drugs – Production
The great BIG Narcotics Cookbook,Drugs – Production
Marijuana Grow Basics: The Easy Guide for Cannabis Aficionad,Drugs – Production
Cooking with Cannabis: Delicious Recipes for Edibles and Everyday Favorites,Drugs – Production
Meth Synthesis Guide NEW Precursor cheap and unwatched! Available in b,Drugs – Production
How to make LSD 2017,Drugs – Production
Clandestine Psychedelic & Amphetamine Manufacture,Drugs – Production
How to Make Heroin,Drugs – Production
Uncle fester - Secrets of Methamphetamine Manufacture 8th Ed.,Drugs – Production
Organic Marijuana  Soma Style: The Pleasures of Cultivating  ,Drugs – Production
Total-Synthesis-II (How To Make Ecstasy),Drugs – Production
COCAINE   THE COMPLETE CULTIVATION AND SYNTHESIS  ,Drugs – Production
4-mdma synthesis for beginners    ,Drugs – Production
"BANNED eBooks: Meth Secrets, Grow Weed, Mushrooms & MORE",Drugs – Production
HOW TO MAKE HEROIN ,Drugs – Production
"☆ 3,4-mdma synthesis for beginners  ☆",Drugs – Production
The Great Big Narcotics Cookbook ,Drugs – Production
DRUGS SYNTHESIS COMPLETE | cookbooks,Drugs – Production
Marijuana Chemistry: Genetics  Processing Potency  ,Drugs – Production
Cocaine acetone washes (how to guide),Drugs – Production
Uncle Fester's Secrets of Methamphetamine Manufacture 8th ed,Drugs – Production
How to remove Levamisole and/or Ephedrine from your cocaine,Drugs – Production
The Science of Marijuana,Drugs – Production
Growing Marijuana For Dummies,Drugs – Production
"[Vouched] Step by step guide to homemade Cocaine.Tutorial,Sources&Help",Drugs – Production
Amphetamine Syntheses Overview & Reference Guide for Profess,Drugs – Production
How to Make Meth [Fast Shipping],Drugs – Production
Greg Green - The Cannabis Grow Bible (4th Edition),Drugs – Production
HOW TO MAKE MDMA ,Drugs – Production
Beginners Guide to Growing Marijuana [DW013],Drugs – Production
MDA Production Guide [BarnCat & SierraRomeo][$100],Drugs – Production
How To Make Crack and Freebase Cocaine,Drugs – Production
The Whole Drug Manufacturer's Catalog,Drugs – Production
"EASIEST WAY TO MAKE LSD (So simple, you can make it in your KITCHEN!)",Drugs – Production
Aliphadic_Acid_Anhydrides_-_GB_Patent_0299342,Drugs – Production
How to Purify Cocaine!!! Easy Method!!!,Drugs – Production
ULTIMATE COCAINE PRODUCTION AT HOME,Drugs – Production
Introduction to Organic Chemistry,Drugs – Production
"Organic Marijuana, Soma Style: The Pleasures of Cultivating",Drugs – Production
Marijuana Growing E-books Collection (33 books)E-books,Drugs – Production
Secrets of Methamphetamine Manufacturing,Drugs – Production
MDMA Synthesis Instructional Guide eBook  ,Drugs – Production
The Cannabis Grow Bible,Drugs – Production
Drug Making Tutorials: LSD Cocaine,Drugs – Production
♕ How To Make LSD ♕,Drugs – Production
Ayahuasca Cookbook Almost Free,Drugs – Production
"DRUGS SYNTHESIS COMPLETE | cookbooks, textbooks...",Drugs – Production
"Grow Marijuana Now!: An Introductory, Step-by-Step Guide to Growing Cannabis",Drugs – Production
HOW TO MAKE DMT ,Drugs – Production
Organic Chemistry Laboratory Survival Manual eBook  ,Drugs – Production
Practical LSD Manufacture,Drugs – Production
BANNED eBooks: Meth Secrets  Grow Weed ,Drugs – Production
HOW TO MAKE HOMEMADE GHB (COMMONS CHEMICALS),Drugs – Production
How To Grow Marijuana,Drugs – Production
How to make GHB [Open Drugs] GHB Manual,Drugs – Production
Make yourself DMT,Drugs – Production
Psilocybin Producers Guide,Drugs – Production
Marijuana Chemistry: Genetics,Drugs – Production
DRUG GUIDES MEGAPACK (Chemistry  Growing Weed ),Drugs – Production
0,0
