Product Name,New Code
How to get iPhones 6 for $150 - Private eBook,eBooks – Other
The Panama Papers Breaking the Story 2016,eBooks – Other
Big History 2016,eBooks – Other
Engels -  Socialism Utopian,eBooks – Other
Collection Of Banned Books,eBooks – Other
Rogue Heroes The History of the SAS 2016,eBooks – Other
The Spark in the Machine The Science of Acupuncture 2014,eBooks – Other
[INSTANT] Ansible-From Beginner to Pro [EBOOK],eBooks – Other
"The Longevity Book The Science of Aging, the Biology of Strength, and the Privilege of Time",eBooks – Other
40 Sleep Hacks - The Geek's Guide to Optimizing Sleep,eBooks – Other
100 Hacks to Make More Money for Your Business,eBooks – Other
Idiots Guides Zen Doodling 2015,eBooks – Other
Secrets of Ancient America Archaeoastronomy and the Legacy 2015,eBooks – Other
"SexUnderTheSun | We are all journeying | eBooks, Music, Video & more |",eBooks – Other
"Michael Hardt and Antonio Negri, Empire",eBooks – Other
Jacques Derrida  Deconstruction and the Possibility of Justice ,eBooks – Other
Dictionary of Deities and Demons in the Bible -  Second Edition  ,eBooks – Other
Vladimir Nabokov - Lolita,eBooks – Other
Dupont Blasters Handbook,eBooks – Other
100 Deadly Skills The SEAL Operative's Guide 2015,eBooks – Other
Critical Thinking Proven Strategies 2016,eBooks – Other
[PDF] You Are a Badass at Making Money [NEW],eBooks – Other
Adolf Hitler - Mein Kampf - English Translation,eBooks – Other
1984 by George Orwell,eBooks – Other
Women on Top,eBooks – Other
How to Sell Yourself: Winning Techniques,eBooks – Other
The Metallurgy Of Antimony,eBooks – Other
Population Control How Corporate Owners Are Killing Us 2015,eBooks – Other
Guns and Military Ebooks Collection,eBooks – Other
Tower of Basel The Shadowy History of the Secret Bank,eBooks – Other
Jesuit Science and the End of Natures Secrets 2015,eBooks – Other
[Guide]How to start your own Amazon.com clean sales store,eBooks – Other
Econometrics for Finance,eBooks – Other
The Essential Underground Handbook 2003,eBooks – Other
Mutual Funds For Dummies 7th edition 2016,eBooks – Other
Marx Articles from the German French Yearbooks,eBooks – Other
"Badiou, Alain, The Communist Hypothesis",eBooks – Other
absorption_of_nitrous_gases,eBooks – Other
Economics 5th edition 2014,eBooks – Other
Bosteels-Bruno-Post-Maoism-Badiou-and-Politics,eBooks – Other
The Art of Seduction: Robert Greene E-book pdf,eBooks – Other
"Dictionary of Deities and Demons in the Bible, Second Edition",eBooks – Other
Two Nations Indivisible A History of Inequality in America 2016,eBooks – Other
On Course Strategies for Creating Success in College 8th ed 2016,eBooks – Other
Communist manifesto,eBooks – Other
Romeo and Juliet by William Shakespeare,eBooks – Other
Engels -  The Origin of the Family Private Property and the State,eBooks – Other
"Derrida, Jacques (Specters of Marx)",eBooks – Other
Kaplan ACT Premier 2016 with 8 Practice Tests 2015,eBooks – Other
#1 New York Times BestSeller | You Are Bad@SS,eBooks – Other
The Zombie Survival Guide: Complete Protection from the Livi,eBooks – Other
CNC Lathe Machining,eBooks – Other
How To Get Chicks Keep Em Dump Em And Get Em Back Again,eBooks – Other
[INSTANT] Interview Questions in Business Analytics [eBOOK],eBooks – Other
Bookkeeping Kit For Dummies 2012,eBooks – Other
Of Course The Greatest Collection Of Riddles and Brain Teasers,eBooks – Other
16 Assorted Ways To Kill Someone,eBooks – Other
communists like us,eBooks – Other
Music Theory For Dummies 3rd edition 2015,eBooks – Other
25 Classic Books,eBooks – Other
100 questions about fascism oswald mosley (buy 1 get 1 free),eBooks – Other
Jean Baudrillard (The Consumer Society Myths and Structures) ,eBooks – Other
The ISIS Hostage One Mans True Story 2016,eBooks – Other
How To Talk To Absolutely Anyone: Confident Communication,eBooks – Other
50 Things You're Not Supposed to Know,eBooks – Other
Jean Baudrillard (Selected Writings) ,eBooks – Other
Jean Baudrillard   (For a critique of the political economy of the sign)  ,eBooks – Other
100 Deadly Skills: The SEAL Operative’s Guide to Eluding P,eBooks – Other
CatiaV5R7 Prismatic Machining Book,eBooks – Other
[Guide] Big Safety Guide,eBooks – Other
Slavoj Zizek (Living in the End of Times)  ,eBooks – Other
█ █ E- BOOK OF FORBIDDEN KNOWLEDGE  █ █▄▀▄▀▄▀▄▀▄▀▄▀▄▀▄▀▄▀▄▀▄▀▄▀▄▀▄▀,eBooks – Other
Sects Lies and the Caliphate 2016,eBooks – Other
"OVER 970 ""FOR DUMMIES"" EBOOKS ONLY $5",eBooks – Other
Why Marx was Right,eBooks – Other
Illegal Collection Of Banned Books,eBooks – Other
25 Greatest Science Books of All Time ⟁ (͠≖ ͜ʖ͠≖),eBooks – Other
"Baudrillard, Jean (The Spirit of Terrorism)",eBooks – Other
01-04-20-politische-biographie (buy 1 get 1 free),eBooks – Other
Lord of the Rings - Complete Collection,eBooks – Other
KILL OR GET KILLED - 1943 Edition (Very Rare),eBooks – Other
THE MONEY MANUAL. Most profitable/Informative+ Cheapest,eBooks – Other
How to Speak and Write German,eBooks – Other
Ultimate Ebook Pack ââ200 EBOOKSââ -only $10,eBooks – Other
Your Brain on Food: How Chemicals Control Your Thoughts,eBooks – Other
Lolita: Vladimir Nabokov,eBooks – Other
♕ Collection of Esoteric Ebooks ♕,eBooks – Other
EZ Cash techniques EBOOK,eBooks – Other
The Modern Alpha Male 2014,eBooks – Other
"12,000+ Kindle Book Pack",eBooks – Other
Black Book of Lie Detection,eBooks – Other
✔ ⟁ 600 iBooks for iPhone & iPad ⟁ (͠≖ ͜ʖ͠≖),eBooks – Other
How to Talk to Anyone: 92 Little Tricks for Big Success in R,eBooks – Other
The Essential Underground Handbook,eBooks – Other
Boaz david (Libertarianism Primer),eBooks – Other
Managing for People Who Hate Managing 2012,eBooks – Other
"Richard Jean Lane, Baudrillard",eBooks – Other
1984(Audio Book),eBooks – Other
Collection of Esoteric Ebooks  ,eBooks – Other
Homesteading The Complete Guide to Self Sufficiency 2015,eBooks – Other
"Engels, Anti Duhring",eBooks – Other
"Codex Magica: Secret Signs, Mysterious Symbols, and Hidden Codes of the Illuminati",eBooks – Other
_light's cheap goodies* Guides/books/software for $10 or less!,eBooks – Other
How To Start A Conversation And Make Friends,eBooks – Other
Ponzimonium How Scam Artists Are Ripping Off America 2016,eBooks – Other
The Rise and Fall of Communism,eBooks – Other
All The Authors,eBooks – Other
Aleister Crowley - The Book of Lies,eBooks – Other
How to Success!!!!,eBooks – Other
Raising Witches,eBooks – Other
EBOOK OF FORBIDDEN KNOWLEDGE,eBooks – Other
The Agile Mind Set Making Agile Processes Work 2015,eBooks – Other
Baudrillard (The Mirror of Production),eBooks – Other
The Anarchist Cookbook,eBooks – Other
22 Ways to Kill a Man with Your Bare Hands,eBooks – Other
Marx Collection,eBooks – Other
The Ethics of Influence Government in the Age of Behavioral 2016,eBooks – Other
"Baudrillard, Jean (For a critique of the political economy of the sign)",eBooks – Other
"Althusser, Louis For Marx (buy 1 get 1 free)",eBooks – Other
The Nazis and the Occult 1989,eBooks – Other
Book of Forbidden Knowledge,eBooks – Other
Codex Magica: Secret Signs -  Mysterious Symbols ,eBooks – Other
Anarchy Cookbook Version 2000,eBooks – Other
Badass Survival Secrets Essential Skills to Survive,eBooks – Other
Persuasion Equation The Subtle Science of Getting Your Way 2015,eBooks – Other
Marx Articles from the Labour Standard,eBooks – Other
Real Time Relationships The Logic of Love,eBooks – Other
The Stars The Definitive Visual Guide 2016,eBooks – Other
"Baudrillard, Jean (Simulacra and Simulation)",eBooks – Other
How To Make Women Laugh,eBooks – Other
How (Not) to Achive Freedom,eBooks – Other
Sworn in Secret Freemasonry and the Knights Templar 2013,eBooks – Other
The Seven Deadly Sins of Psychology 2017,eBooks – Other
Engels -  Condition of the Working Class in England  ,eBooks – Other
Aleister Crowley - Magick without Tears,eBooks – Other
"eBook -- A Guide To Making Passive Income, very cheap atm!",eBooks – Other
A Wiccan Bible,eBooks – Other
How To Tap The Incredible Secret Powers Of Your Mind,eBooks – Other
voynich manuscript,eBooks – Other
Aleister Crowley - The Book of Thoth [DW010],eBooks – Other
Show Me How: 500 Things You Should Know,eBooks – Other
Economics After Capitalism A Guide to the Ruins and a Road,eBooks – Other
How to Think About Weird Things,eBooks – Other
Science of Getting Rich - Wallace D. Wattles,eBooks – Other
[$10] Swatting tutorial for worldwide,eBooks – Other
Top 100 Lovemaking Techniques of All Time,eBooks – Other
Althusser  Louis For Marx,eBooks – Other
Lucifer Rising British Intelligence and the Occult 2016,eBooks – Other
Wicca and Witchcraft E-Books Collection,eBooks – Other
"Zizek, Slavoj (Living in the End of Times)",eBooks – Other
Inside Story Politics Intrigue and Treachery 2016,eBooks – Other
Getting Started With Raspberry Pi 3rd edition 2016,eBooks – Other
"Engels, The Origin of the Family Private Property and the Stat",eBooks – Other
"Zizek, Slavoj (In Defense of Lost Causes)",eBooks – Other
Economics Principles Applications and Tools 9th edition 2017,eBooks – Other
Deal The First Deadly Blow,eBooks – Other
600 iBooks for iPhone & iPad ⟁ (͠≖ ͜ʖ͠≖),eBooks – Other
"Engels, Synopsis of Capital",eBooks – Other
Become a Con Artist: Ultimate Social Engineering Guide,eBooks – Other
"SPECIAL DEAL! Pay $5, GET ALL OF MY EBOOKS!",eBooks – Other
Ebooks For Dummies Collection (370 ebooks),eBooks – Other
DO IT YOURSELF GUIDE PACK 700+,eBooks – Other
Engels -  Synopsis of Capital  ,eBooks – Other
The Financial Crisis of Our Time,eBooks – Other
100 Fastest-Growing Careers: Your Complete Guidebook to Majo,eBooks – Other
Book of Forbidden Knowledge. Basil Lacroix Aka Basil crouch,eBooks – Other
Slavoj Zizek (The Plague of Fantasies) ,eBooks – Other
How To Talk So People Listen: The Real Key to Job Success,eBooks – Other
1-leo-frank-case-watsons-magazine-january-1915 (buy 1 get 1 free),eBooks – Other
100 Reasons We’re Glad To Be Men (buy 1 get 1 free),eBooks – Other
Contemporary Engineering Economics 6th edition 2016,eBooks – Other
How to Make People Like You in 90 Seconds or Less,eBooks – Other
Preppers Long Term Survival Guide 2014,eBooks – Other
Dummies E-Book ULTRA Collection - 9GB - 978 E-Books,eBooks – Other
Into the Lions Mouth The True Story of Dusko Popov 2016,eBooks – Other
Dummies Super Pack of Books,eBooks – Other
The Complete Guide to Picking Up Girls On Facebook,eBooks – Other
Jean Baudrillard  (The Spirit of Terrorism)  ,eBooks – Other
Michael Hardt  Common Wealth  ,eBooks – Other
The Accumulation of Freedom Writings on Anarchist Economics 2012,eBooks – Other
Men of the Code Living as a Superior Man 2015,eBooks – Other
Jacques Derrida -  (Specters of Marx)  ,eBooks – Other
Penis Enlargement Exercises,eBooks – Other
"Engels, Socialism Utopian and Scientific",eBooks – Other
Digital Photography For Dummies 8th edition 2016,eBooks – Other
Conjuring Hitler,eBooks – Other
Doublespeak Language to Deceive You 2016,eBooks – Other
9-11 Synthetic Terror (buy 1 get 1 free),eBooks – Other
The Longevity Book The Science of Aging -  the Biology of Strength ,eBooks – Other
anti duhring engels,eBooks – Other
✔ ⟁ 58 Sexual Ebooks Pack ⟁ (͠≖ ͜ʖ͠≖),eBooks – Other
"Anarchist Cookbook - BOMBS, GUN POUDER, DRUGS, and all sort of Anarchy",eBooks – Other
"Engles, The Peasant Question in France and Germany",eBooks – Other
✔ ⟁ Muscle Exercises Encyclopedia ⟁ (͠≖ ͜ʖ͠≖),eBooks – Other
"Authors, All the, THE IDEA OF COMMUNISM (buy 1 get 1 free)",eBooks – Other
Mega Pack Of Sex Ebooks,eBooks – Other
The Cheaters Handbook : The Naughty Students Bible,eBooks – Other
[REVIEWED][$25]EBOOK MEGA PACK OVER 5GB of HQ INFORMATION!,eBooks – Other
OVER 970   FOR DUMMIES   EBOOKS ONLY $5 ,eBooks – Other
Physical Principles of Food Preservation,eBooks – Other
"Baudrillard, Jean (The Consumer Society.Myths and Structures)",eBooks – Other
"Coleman, John (One World Dictatorship)",eBooks – Other
200 Amazing Ebooks,eBooks – Other
"Berardi, Franco (The Soul At Work)",eBooks – Other
Franco (The Soul At Work) ,eBooks – Other
Zizek  Slavoj (In Defense of Lost Causes) ,eBooks – Other
How to Win Every Argument: The Use and Abuse of Logic,eBooks – Other
Science in the Soul Richard Dawkins 2017,eBooks – Other
The End of Science Facing the Limits of Knowledge 2015,eBooks – Other
Richard Jean Baudrillard Lane,eBooks – Other
Julia Kristeva -  The Sense and Non sense of Revolt  ,eBooks – Other
Straight to Hell True Tales of Deviance Debauchery 2015,eBooks – Other
Dispirited How Contemporary Spirituality Makes Us Stupid,eBooks – Other
The GCHQ Puzzle Book 2016,eBooks – Other
The Write Way to Succeed,eBooks – Other
How To Stop Getting Panic Attacks,eBooks – Other
David Lane (88 precepts),eBooks – Other
The Big Data Driven Business 2015,eBooks – Other
Pick-a-Book List: TEXTBOOKS: Accounting Economics Finance Management & Marketing,eBooks – Other
"Engels, Condition of the Working Class in England",eBooks – Other
The Majesty of Vue.js 2016,eBooks – Other
Drill Sharpening,eBooks – Other
The Agile Consultant Guiding Clients to Enterprise Agility 2016,eBooks – Other
"I just added a ton of guides/ebooks to my store, all for $0.50usd each",eBooks – Other
How to Start and Win Any Fight,eBooks – Other
Shadow Wars The Secret Struggle for the Middle East 2016,eBooks – Other
The Conquest of Bread,eBooks – Other
Hagakure: The Book of the Samurai,eBooks – Other
"Eagleton, Terry (Why Marx was Right)",eBooks – Other
Writing for Interaction Crafting the Information Experience 2013,eBooks – Other
THE ULTIMATE BITCOIN MONEY MAKING GUIDE,eBooks – Other
Being Logical: A Guide to Good Thinking,eBooks – Other
Coleman  John (One World Dictatorship)  ,eBooks – Other
Muscle Exercises Encyclopedia ⟁ (͠≖ ͜ʖ͠≖),eBooks – Other
Let Your Inner Alpha Loose 2015,eBooks – Other
Mastering Witchcraft: A Practical Guide for Witches,eBooks – Other
Boggs-Carl-Marxism-Prefigurative-Communism-and-Problem-Workers-Control,eBooks – Other
How Do I Do That in Photoshop 2016,eBooks – Other
Crime and Punishment by Fyodor Dostoyevsky,eBooks – Other
How to Persuade People Who Don't Want to be Persuaded: Get What You Want Every Time!,eBooks – Other
ANARCHIST COOK BOOK 4 (2017),eBooks – Other
How to Win at Feminism,eBooks – Other
The Plots Against Hitler 2016,eBooks – Other
Fueling Freedom Exposing the Mad War on Energy 2016,eBooks – Other
The Worst-Case Scenario Survival Handbook,eBooks – Other
On Truth The Tyranny of Illusion,eBooks – Other
Four Futures Life after Capitalism 2016,eBooks – Other
Everyday Anarchy,eBooks – Other
Magician Books - Cards and Other Tricks,eBooks – Other
"Zizek, Slavoj (For they know not what they do)",eBooks – Other
58 Sexual Ebooks Pack,eBooks – Other
FREE Security Guide,eBooks – Other
How to Win Friends And Influence People,eBooks – Other
Cancel Cable,eBooks – Other
Anarchists Cookbook IV 4.14,eBooks – Other
Sheath and Knife - Adult Furry Comic - M/M Gay Incest Brothers - wolf boy Yaoi English full color CU,eBooks – Other
Introductory Econometrics A Modern Approach 6th edition 2016,eBooks – Other
Against the Gods (buy 1 get 1 free),eBooks – Other
Glide Customizable Image Loading on Android 2016,eBooks – Other
DO IT YOURSELF GUIDE PACK 700+ ⟁ (͠≖ ͜ʖ͠≖),eBooks – Other
Absorbent_Material_-_GB_Patent_0506929. pdf (buy 1 get 1 free),eBooks – Other
✔ ⟁ 25 Greatest Science Books of All Time ⟁ (͠≖ ͜ʖ͠≖),eBooks – Other
How To Solve Almost Any Sexual Problem The Easy Way,eBooks – Other
"Zizek, Slavoj (The Plague of Fantasies)",eBooks – Other
"Derrida, Jacques (Deconstruction and the Possibility of Justice)",eBooks – Other
Universally Preferable Behavior,eBooks – Other
Idiots Guides Raspberry Pi 2015,eBooks – Other
Ragnar Benson books,eBooks – Other
100 Places You Will Never Visit,eBooks – Other
Michael Hardt and Antonio Negri – Empire,eBooks – Other
Virtual Worlds and Criminality,eBooks – Other
Pocket Sex Guide,eBooks – Other
Construction of Secret Hiding Places,eBooks – Other
The Gardnerian Book of Shadows,eBooks – Other
"Michael Hardt, Common Wealth",eBooks – Other
✔ ⟁ DO IT YOURSELF GUIDE PACK 700+ ⟁ (͠≖ ͜ʖ͠≖),eBooks – Other
Mindfucking: A Critique of Mental Manipulation,eBooks – Other
Kindle Book Pack ,eBooks – Other
The Art of Deception 2003,eBooks – Other
Zizek  Slavoj (For they know not what they do)  ,eBooks – Other
Standard Catalog of Winchester Firearms 3rd edition 2016,eBooks – Other
Over 120 Premium Money Making Ebooks Worth over $2500,eBooks – Other
Guitar Theory For Dummies 2013,eBooks – Other
The Quotable Hitchens From Alcohol to Zionism 2011,eBooks – Other
Jean Baudrillard  Simulacra and Simulation,eBooks – Other
The Science of Getting Rich,eBooks – Other
"Engels, Dialectics of Nature part",eBooks – Other
Casting Metal Parts By Harold Hoffman (Action Book Publishers),eBooks – Other
Absorbent Material GB Patent,eBooks – Other
Practical Anarchy,eBooks – Other
2 tough questions (buy 1 get 1 free),eBooks – Other
Alain Badiou,eBooks – Other
Idiots Guides 3D Printing 2015,eBooks – Other
Social Engineering The Art of Human Hacking (ebook),eBooks – Other
"Baudrillard, Jean (Selected Writings)",eBooks – Other
Engles -  The Peasant Question in France and Germany  ,eBooks – Other
Refining Design For Business 2013,eBooks – Other
"Julia Kristeva, The Sense and Non sense of Revolt",eBooks – Other
Badass Prepper's Handbook Everything You Need to Know to Prepare Yourself for the Worst 2015,eBooks – Other
✔ ⟁ Illegal Collection Of Banned Books ⟁ (͠≖ ͜ʖ͠≖),eBooks – Other
Hands On Mobile App Testing A Guide for Mobile Testers 2015,eBooks – Other
Badass Prepper's Handbook Everything You Need to Know,eBooks – Other
Engels -  Dialectics of Nature part  ,eBooks – Other
Mein Kampf - English,eBooks – Other
The Movie Book 2016,eBooks – Other
0,0
