Product Name,New Code
The Hacker's Collection,Hacking – General
HACKING SUPER PACK OF BOOKS,Hacking – General
Hacking boards,Hacking – General
Learning Nessus for Penetration Testing 2014,Hacking – General
HACKING guide bundle|mysql injection|doxxing|botnets|pdf backdooring,Hacking – General
Basics of Hacking and Penetration Testing 2nd Updated Ed. (Aug 2013),Hacking – General
Hacking china's alipay wallet tutorial .earn big money . Easy! Fast!,Hacking – General
Hacking pack 30+ guides ($25),Hacking – General
Securing and hacking your router [GUIDE],Hacking – General
Someone has hacked my VENDOR account - SmileyPostman,Hacking – General
1000 Hacking Tutorials,Hacking – General
***CERTIFIED ETHICAL HACKER OFFICIAL COURSE!!***(Clone),Hacking – General
The Hacker’s Underground Handbook  ,Hacking – General
deepnet hack forums?,Hacking – General
OzRort's School of Swindle - Hacking RDPs,Hacking – General
snapbbs hacked again by snitch,Hacking – General
"Offer!!! Hacking Megapack Source Code Tools!!! Crypters, Rat",Hacking – General
18 Extensions For Turning Firefox Into a Penetration Tes,Hacking – General
Any countryHacked RDP cheapest on Market ,Hacking – General
Hacking - The Beginners Guide to Master The Art of Hacking In No Time.pdf,Hacking – General
Traffickers using hackers to import drugs into major Europe ports,Hacking – General
Hacking for Dummies,Hacking – General
"hack , make 9000 a month",Hacking – General
A Study of Black Hole Attack Solutions 2016,Hacking – General
RAR pass cracking,Hacking – General
hack whats app,Hacking – General
▓▒░ FREE PACK HACK THE PLANET ▓▒░,Hacking – General
Advanced Persistent Threat Understanding the Danger and How,Hacking – General
account hacked ??,Hacking – General
✔ ⟁ HACKERS COLLECTION - OVER 15 TUTORIALS ⟁ (͠≖ ͜ʖ͠≖),Hacking – General
Hacking: Hacking Practical Guide for Beginners,Hacking – General
Hack Your School Grading System   ,Hacking – General
Thinking Security Stopping Next Year's Hackers 2015,Hacking – General
Hacking The Beginners Guide to Master The Art of Hacking,Hacking – General
SQL Injection Tool Software Megapack,Hacking – General
Hacking: The Ultimate Guide,Hacking – General
Advanced Persistent Threat Hacking The Art 2015,Hacking – General
Advanced Persistent Threat Hacking The Art and Science of Hacking Any Organization,Hacking – General
MASSIVE HACKPACK  3GB  UPDATED ,Hacking – General
Link to Russian Hacking Mega-Software Site (1000+ Softwares),Hacking – General
Hacking for Dummies 5th Edition E-Book,Hacking – General
Pick-10-Book List: HACKING,Hacking – General
Ultimate Hacking Megapack 14gb,Hacking – General
The Hacker Playbook: Practical Guide To Penetration Testing,Hacking – General
| FliP's Hacking Guides | Into the Black and Back Part 1,Hacking – General
The Most Indepth Hacker's Guide 2015,Hacking – General
Atm hack to get much more money than you withdraw,Hacking – General
A Beginners Guide To Hacking Computer Systems,Hacking – General
Compiled hacking tools (Windows),Hacking – General
A Hacker in a Hacker World,Hacking – General
Penetration Testing: A Hands-On Introduction to Hacking,Hacking – General
✪ ATM Hack to get much more money than you withdraw,Hacking – General
Hack With IP Address,Hacking – General
How To Hack a Coca Cola Machine,Hacking – General
Secrets To Becoming A Genius Hacker,Hacking – General
How To Become A Hacker - Encyclopedia of Cybercrime,Hacking – General
Hacking Mega Pack---1417 Items,Hacking – General
"Ebooks of Hacking, Carding and much more",Hacking – General
1000 Hacking Tutorials (The Best of),Hacking – General
Pick-a-Book List: HACKING,Hacking – General
5 ATM HACKING TUTORIALS,Hacking – General
The FBI Hacking & Forensic Toolkit ,Hacking – General
inputs.io hacked,Hacking – General
ULTIMATE Hacking Pack for NEWBIES 9 GUIDES,Hacking – General
Link to Russian Hacking Mega-Software Site,Hacking – General
VIDEO: Complete Hacking Course Go from Beginner to Advanced,Hacking – General
HACKED RDP SERVICE (LIFETIME),Hacking – General
ULTIMATE hacking pack for NEWBIES 9 GUIDES,Hacking – General
COMPLETE HACKING COURSE [FROM A-Z] GO FROM NOOB TO EXPERT,Hacking – General
Hacking for Beginners---406 Items,Hacking – General
Pick-a-Book List: PENETRATION TESTING (Pentesting) & METASPLOIT,Hacking – General
"[E-BOOK COLLECTION] HACKING (2,6GB]",Hacking – General
method to hack electricity network by connecting to the power line,Hacking – General
Mega HACK Pack for Beginners 2GB,Hacking – General
Hitch Hackers Guide to the Network 2016,Hacking – General
0,0
