Product Name,New Code
Delete negative accounts from your credit report,Modifying Credit
Create Your own CPN + Tri-Merge + Credit Lines (+RESALE),Modifying Credit
How i create a CPN number from scratch,Modifying Credit
Get Tri-merged CPN with Credit Lines Resale Right NTRO OFFER,Modifying Credit
Remove Negative Items From Your Credit Report Permanently,Modifying Credit
Contact info to a reputable CPN vendor for credit profiles,Modifying Credit
â â â Credit building credit cards tips and tricks â â â,Modifying Credit
█ █ CREATE HIGH CREDIT SCORE GHOSTS IN BUREAUS SYSTEMS  █ █,Modifying Credit
[GUIDE] Advanced How to Open Credit Lines + Square Cashout Bundle,Modifying Credit
How to create a CPN Profile and Tri-Merge it,Modifying Credit
How to add your own trade lines(Clone),Modifying Credit
Contact info to a reputable CPN vendor for credit profiles ,Modifying Credit
Delete collections from your credit report,Modifying Credit
"TRADELINE for CPN or Personal Credit Repair $25,000",Modifying Credit
Tradelines- AU and Primaries(Clone),Modifying Credit
CREDIT SECRETS PACK - BOOST CREDIT SCORE - ▄▀▄▀▄▀▄▀▄▀▄▀▄▀▄▀▄▀▄▀▄▀▄▀▄▀▄▀GET A NEW CREDIT PROFILE,Modifying Credit
How To create Cpns ( PROFESSIONAL SERIES )(Clone,Modifying Credit
How To Create High Credit Score Ghosts Bureaus System,Modifying Credit
CREATE HIGH CREDIT SCORE GHOSTS IN BUREAUS SYSTEMS,Modifying Credit
How to Get a New Credit Report Identity (Tested in USA),Modifying Credit
TRADELINE for CPN or Personal Credit Repair $5000,Modifying Credit
MAKING HIGH CREDIT SCORES MEGA-SYSTEM,Modifying Credit
Authorised User Trade line(Clone),Modifying Credit
How to Get a New Credit Report Identity (Tested & Works),Modifying Credit
CREDIT SECRETS PACK - BOOST CREDIT SCORE - GET A NEW CREDIT PROFILE,Modifying Credit
How to add your own trade lines,Modifying Credit
0,0
