Product Name,New Code
Home delivery,Transportation/Stealth
Australian Mail Drop Guide,Transportation/Stealth
Delivery Options          ,Transportation/Stealth
Stealth Phone,Transportation/Stealth
Best UK drop method for international,Transportation/Stealth
GET YOUR OWN ITEM/MAIL DROP TUTORIAL:USA UK EU INTERNATIONAL,Transportation/Stealth
Guide To Postal Smuggling ,Transportation/Stealth
How to Ship Drugs in the Mail (USPS)    ,Transportation/Stealth
Shipping drugs to a drop?,Transportation/Stealth
likelihood of further investigation after a seized package at customs,Transportation/Stealth
Delivery Options,Transportation/Stealth
How to ship anonymously recorded items UK,Transportation/Stealth
2 packs show delivered however they are not there!! what to do please!,Transportation/Stealth
Shipping Schedule,Transportation/Stealth
Best Way To Recieve A Package In Australia?,Transportation/Stealth
Re - Ship Issue,Transportation/Stealth
please advice me for method of send the package           ,Transportation/Stealth
Supplying tracking number to customer,Transportation/Stealth
"International ""research chemical"" package seized and reshipped",Transportation/Stealth
No Tracking = Real Security?,Transportation/Stealth
stealth when shipping large vials,Transportation/Stealth
Shipping Worldwide,Transportation/Stealth
{VOUCHED}****New Drop Guide**** (Fresh Idea),Transportation/Stealth
My package is @ the USJFCOM in VA IS THIS NORMAL?!        ,Transportation/Stealth
How to pay for prepaid shipping labels,Transportation/Stealth
Guide To postal Smuggling ,Transportation/Stealth
'Smelly Parcel' -UK specific,Transportation/Stealth
P.O box with real id?,Transportation/Stealth
Mail Being Searched Through?,Transportation/Stealth
P.O. Box inquiry,Transportation/Stealth
Need Help LE Proofing my Drop Address,Transportation/Stealth
Correct address format for sending parcels in Australia,Transportation/Stealth
USPS Has Shipped Two Packages to Return Address,Transportation/Stealth
Reshipping services - US to worldwide? (carded items),Transportation/Stealth
Did my package get seized?,Transportation/Stealth
Best way to track Shipping without raising flags?,Transportation/Stealth
Australia mail drop,Transportation/Stealth
Pot Candy in the Mail,Transportation/Stealth
100usd bounty regarding anonymous international shipping,Transportation/Stealth
Container45158 Anonymous U.S.A Drop Method/Exploit,Transportation/Stealth
UK  Date moved to current address,Transportation/Stealth
Australian Drops Guide,Transportation/Stealth
Shipping Schedule         ,Transportation/Stealth
Mail Drop Guide/Tips,Transportation/Stealth
Delivery,Transportation/Stealth
Guide to Postal Smuggiling  Make the USPS Work for YOU,Transportation/Stealth
Drop adresses,Transportation/Stealth
♔ Guide to Postal Smuggling eBook ♔,Transportation/Stealth
Need help printing postage online,Transportation/Stealth
Overseas customs & how it works if its stopped?,Transportation/Stealth
How to receive the orders in Germany?,Transportation/Stealth
[UK] Payment fee - possible seizure?,Transportation/Stealth
Best way to send Priority Express Mail,Transportation/Stealth
How to extract cocaine from Paper or Paperboard,Transportation/Stealth
Guide to Postal Smuggling eBook         ,Transportation/Stealth
USA drop and reship service for newly issued CC,Transportation/Stealth
HOW TO SHIP MARIJUANAAND NOT GET CAUGHT,Transportation/Stealth
picking up package at post office,Transportation/Stealth
I will pay you $50 in btc to teach me how to ship 4 oz weed,Transportation/Stealth
Getting CF delivered safely,Transportation/Stealth
USPS wants me to sign to pick up a package,Transportation/Stealth
Shipping/Customs,Transportation/Stealth
package possibly seized UK?,Transportation/Stealth
AUS International Orders,Transportation/Stealth
"packages seized, should i be concerned",Transportation/Stealth
question about drop,Transportation/Stealth
Australian Mail Drop Guide UPDATED 1.2,Transportation/Stealth
Profiling postal packages VENDORS MUST READ,Transportation/Stealth
Shipping drugs and Weapons,Transportation/Stealth
How to extract cocaine from Paper or Paperboard           ,Transportation/Stealth
Drop address,Transportation/Stealth
What will Canada Customs (and others) do with a seized drug package?,Transportation/Stealth
Best DROP IDEA IN YEARS Works anywhere. Unlimited drops. . free. SAFE,Transportation/Stealth
"Unlimited Drops, and of course the Best Drops",Transportation/Stealth
How are people handling larger shippments?,Transportation/Stealth
Guide to Postal Smuggiling Make the USPS Work for YOU     ,Transportation/Stealth
Shipping method requirement for carded items - suggestion.,Transportation/Stealth
How to beat a controlled delivery!! MUST READ!!!          ,Transportation/Stealth
Drop address?,Transportation/Stealth
Sending US Mail with Or Current Resident text?,Transportation/Stealth
UK receiving parcels,Transportation/Stealth
US Customs letter?,Transportation/Stealth
USPS slow processing?,Transportation/Stealth
"Received empty box from ""reputable"" vendor, refusing to refund/reship",Transportation/Stealth
BTC with Paypal or safe shipping,Transportation/Stealth
Receiving Packages Safely ,Transportation/Stealth
How to stay anon with drop-reship?,Transportation/Stealth
bill=ship problem,Transportation/Stealth
signing for pakages,Transportation/Stealth
Safety for personal use orders,Transportation/Stealth
UK MBE Drop ID Check,Transportation/Stealth
HOW TO SHIP DRUGS STEALTHY - TUTORIALS AND VIDEO,Transportation/Stealth
POSTAL SMUGGLING - Concealment Methods,Transportation/Stealth
[GUIDE] - How to get a UK drop for Letters & Parcels,Transportation/Stealth
Opening PO Box with fake ID,Transportation/Stealth
Drop for amazon neccesary?,Transportation/Stealth
How do I send mail with a fake return address?,Transportation/Stealth
Guide To postal Smuggling,Transportation/Stealth
All this talk about using drops...,Transportation/Stealth
HOW TO SHIP DRUGS or GUNS STEALTH V.2  ▄▀▄▀▄▀▄▀▄▀▄▀▄▀▄▀▄▀▄▀▄▀▄▀▄▀▄▀,Transportation/Stealth
amazon gift cards - how do you mail the actual goods to yourself?,Transportation/Stealth
"caught by the cops and now being watched, advise???",Transportation/Stealth
What are your thoughts on shipping packages through FedEx?,Transportation/Stealth
Seizure letter then helicopters. Being paranoid?,Transportation/Stealth
Just got Love letter in my Box IN Germany,Transportation/Stealth
Question about shipping weed & priority stamps,Transportation/Stealth
Question about P.O. Box,Transportation/Stealth
Is it safe to order to your home address?,Transportation/Stealth
please advice me for method of send the package,Transportation/Stealth
US Mail Document Drop?,Transportation/Stealth
Shipping question,Transportation/Stealth
"Know your postman, remember his face well, UK",Transportation/Stealth
GUIDE TO POSTAL SMUGGLING,Transportation/Stealth
How to Ship Safely Super Pack ($10 Pack),Transportation/Stealth
Shipment handling!,Transportation/Stealth
"UK to UK order, Royal Mail want more money - Trap?",Transportation/Stealth
Experiences with intercepted shipments within West-EU,Transportation/Stealth
Best place to get drugs delivered?,Transportation/Stealth
recieve packages annonymously?,Transportation/Stealth
How to create your own drop in the Netherlands,Transportation/Stealth
Royal mail Â£1.11,Transportation/Stealth
How to beat a controlled delivery!! MUST READ!!!,Transportation/Stealth
POSTAL SMUGGLING - Concealment Methods  ,Transportation/Stealth
How to Ship Safely Super Pack ($20 Pack),Transportation/Stealth
High risk countries to import from?,Transportation/Stealth
How do you print anonymous USPS shipping labels with tracking?,Transportation/Stealth
Receiving a package safely ???,Transportation/Stealth
drops,Transportation/Stealth
international Postage,Transportation/Stealth
Safe Shipping Procedures,Transportation/Stealth
Stealth Phone             ,Transportation/Stealth
SHIPPING to AUSTRALIA,Transportation/Stealth
address mail for the darknet            ,Transportation/Stealth
The use of a PMB(Private Mailbox) in a friends name? Tips etc?,Transportation/Stealth
USPS wants me to come sign for something.,Transportation/Stealth
How to ship priority without entering the post office,Transportation/Stealth
Best place to keep your drug stash,Transportation/Stealth
Mail Forwarding services,Transportation/Stealth
Tracking,Transportation/Stealth
Shipping from China,Transportation/Stealth
"to be stealthy, or not to be stealthy,whats the best stealth shipping?",Transportation/Stealth
About drop re-ship,Transportation/Stealth
Best guide for setting up a drop?,Transportation/Stealth
SAFEST WAY TO SHIP NOWDAYS ANY ADVICE WOULD BE APPRECIATED.......,Transportation/Stealth
How do you make your parcels stealthier? (weed),Transportation/Stealth
advice what to do next after (domestic) order did not arrive,Transportation/Stealth
Problems at the customs?,Transportation/Stealth
blacklisted address,Transportation/Stealth
Drop services - dont understand,Transportation/Stealth
"The Best Guide On Stealth Shipping - Guns, Drugs, Everything",Transportation/Stealth
█ █ HOW TO SHIP DRUGS STEALTHY - TUTORIALS AND VIDEO  █ █▄▀▄▀▄▀▄▀▄▀▄▀▄▀▄▀▄▀▄▀▄▀▄▀▄▀▄▀,Transportation/Stealth
The Art of Smuggling (OVDB Production),Transportation/Stealth
Ultimate Postal Smuggling Concealment Never Lose Parcel   ,Transportation/Stealth
Canadian Postage Unmarked stamps...,Transportation/Stealth
Mail man acting weird,Transportation/Stealth
Deleting identifying information after product has been shipped,Transportation/Stealth
Drop problem,Transportation/Stealth
Orders not arriving. Need advice!,Transportation/Stealth
Whats the best way to open a po box?,Transportation/Stealth
postage due?!,Transportation/Stealth
"Help, received an empty envelope!",Transportation/Stealth
Ultimate BANK DROP Creation Guide,Transportation/Stealth
Shipping question         ,Transportation/Stealth
Package controlled in Holland but send to receiver,Transportation/Stealth
Priority Postage Anonymously,Transportation/Stealth
Anti-interception phones .... really ?,Transportation/Stealth
DRUG VENDOR ... shipping ?,Transportation/Stealth
How likely is it that LE will check your drop?,Transportation/Stealth
Dangerous lot number in Moisture barrier bags?,Transportation/Stealth
Too big for letterbox? What should I do..,Transportation/Stealth
Need a motion sensing device for my anonymous mail drop,Transportation/Stealth
High risk countries to import from?     ,Transportation/Stealth
HELP-about shipments,Transportation/Stealth
NEW way to have an anonymous drop point 2015  ,Transportation/Stealth
Drop Setup: Questions and Ideas,Transportation/Stealth
0,0
