Product Name,New Code
i will swap my â¬20 euro templates ( 200 euro value ) for some uk fullz,Counterfeit Currency
$100 counterfeit guide ebook and templates,Counterfeit Currency
removing ink from cheques,Counterfeit Currency
Fake Notes and Fake Currency PSD Templates for $20,Counterfeit Currency
Making Fake Currency Mega Pack with PSD Templates - $1 to $100 - €20 to €102,Counterfeit Currency
exchanging counterfeit cash,Counterfeit Currency
HOW TO MAKE HIGH QUALITY DOLLARS COUNTERFEITS,Counterfeit Currency
[HIGH QUALITY] â¬50 Template Pack [FAKE50EUROSGUIDE],Counterfeit Currency
Counterfeiting money tutorial,Counterfeit Currency
How to Make Counterfeit USD Using the Bleaching Method,Counterfeit Currency
Making Fake Currency Mega Pack with PSD Templates - $1 to $100 - €20 to €101,Counterfeit Currency
How to Use Counterfeit Money 2017,Counterfeit Currency
The Art of Making Money: The Story of a Master Counterfeiter,Counterfeit Currency
How to make your own 50 notes,Counterfeit Currency
Fake Notes and Fake Currency PSD Templates for $50,Counterfeit Currency
HOW TO MAKE FAKE £20 NOTES,Counterfeit Currency
HOW TO PASS COUNTERFEIT MONEY,Counterfeit Currency
learn how to make counterfeit 20 notes [FULL GUIDE] for only â¬20!,Counterfeit Currency
How To Pass Counterfeit Money,Counterfeit Currency
ordering counterfeit cash into ireland,Counterfeit Currency
[HIGH QUALITY] â¬20 Template Pack [FAKE50EUROSGUIDE],Counterfeit Currency
Would you be interested in learning how to make counterfeit £20 notes?,Counterfeit Currency
HOW TO MAKE FAKE £20 NOTES ▄▀▄▀▄▀▄▀▄▀▄▀▄▀▄,Counterfeit Currency
"13GB of PSDs - Fake bills, Scans, Passports, DL &",Counterfeit Currency
[VOUCHED] How to pass counterfeits /the right way/,Counterfeit Currency
HOW TO PASS COUNTERFEIT MONEY ▄▀▄▀▄▀▄▀▄▀▄▀▄▀▄▀▄▀▄,Counterfeit Currency
Print Fake Money,Counterfeit Currency
Fake Notes and Fake Currency PSD Templates,Counterfeit Currency
Fake Notes and Fake Currency PSD Templates for €100,Counterfeit Currency
Print your own money,Counterfeit Currency
"FOR SALE HIGH QUALITY DOLLAR BILLS EUROS,POUNDS AUTOMATIC SSD CHEMICAL",Counterfeit Currency
0,0
