Product Name,New Code
Encrypt your messages and stay SAFE. Step by step TUTORIAL !,PGP/GPG
Exchanging Files with PGP,PGP/GPG
GPG4USB Tutorial GPG,PGP/GPG
How to make PGP keys fast and secure,PGP/GPG
how to use pgp,PGP/GPG
How to use PGP better ( newbie guide ),PGP/GPG
HOW TO USE PGP ENCRYPTION SAFELY AND SECURELY,PGP/GPG
PGP & GPG: Email for the Practical Paranoid,PGP/GPG
Pgp for idiots - Windows only,PGP/GPG
PGP Tutorial For Newbs (Gpg4Win),PGP/GPG
PGP tutorial for Noobs!!!!,PGP/GPG
THE ULTIMATE PGP TUTORIAL FOR N00BS,PGP/GPG
alternative for true crypt,PGP/GPG
Bad/incorrect PGP signature from Tails!,PGP/GPG
Can you tell who encrpyted a PGP Message?,PGP/GPG
Easy Online PGP creation for noobs!,PGP/GPG
Encrypted Communication,PGP/GPG
Encryption tools the NSA couldn't crack,PGP/GPG
"Encyption of shipping info question(don't need a tut, just a quick Q)",PGP/GPG
Ever used GnuPG? Its author and maintainer is going broke,PGP/GPG
GnuPG on Linux Mint - No GUI? Am I wrong?,PGP/GPG
"GPG in tails, free email without JS.",PGP/GPG
"Luks encryption with a 25 characters password, enough to stop LE?",PGP/GPG
MD5 Hashes,PGP/GPG
"Megachat encrypted VoIP, chat and email",PGP/GPG
Multisig.....,PGP/GPG
Never change a passphrase stoned,PGP/GPG
No pgp,PGP/GPG
Not using PGP for tracking number,PGP/GPG
NSA and GCHQ stolen encryption keys from biggest SIM card manufacturer,PGP/GPG
On TrueCrypt,PGP/GPG
pgp,PGP/GPG
PGP Desktop... or something?,PGP/GPG
PGP In Plain English: A Simple Man's Guide To Using PGP/GPG Like A Pro,PGP/GPG
"PGP isnt working, vendor asked to send via privnote...?",PGP/GPG
PGP KEY Test,PGP/GPG
PGP keys.,PGP/GPG
PGP no signatures found,PGP/GPG
PGP question,PGP/GPG
PGP setup for Linux,PGP/GPG
Questions about PGP,PGP/GPG
TAILS PGP Help,PGP/GPG
True Crypt hidden volume,PGP/GPG
Tutorial PGP,PGP/GPG
Using tails with VPN and how to do pgp,PGP/GPG
Which size PGP is best?,PGP/GPG
Change Email GPG4USB,PGP/GPG
The guy behind GPG is going broke,PGP/GPG
Hey noob to PGP help me practice!,PGP/GPG
using PGP,PGP/GPG
Linked Market and Forum ID's / PGP public keyservera -Safe?,PGP/GPG
complete rundown on using the GPG Suite for MAC ONLY,PGP/GPG
Is the internal messaging system on Evo secure?,PGP/GPG
GPG Subkeys + Encryption,PGP/GPG
What do you guys use for PGP?,PGP/GPG
What is the best most secure PGP/GPG software?,PGP/GPG
Publishing public key all over the net,PGP/GPG
Encryption Client for Kali Linux?,PGP/GPG
How to use PGP better  newbie guide,PGP/GPG
PGP Tutorial For Newbs Gpg4Win,PGP/GPG
How to use PGP better  newbie guide ,PGP/GPG
AutoPGP enabled/disabled,PGP/GPG
PGP KEY and how to encrypt!,PGP/GPG
Do not use AutoPGP,PGP/GPG
GPG Signing: The Double Edge Sword,PGP/GPG
From SK Forum i report this thread interesting on PGP / GPG,PGP/GPG
GPG/PGP Windows/Linux,PGP/GPG
GPG Linux,PGP/GPG
Your PGP/GPG Public Key has changed.,PGP/GPG
French GPG Tutorial,PGP/GPG
Avoiding SHA-1 / Linux / GPG,PGP/GPG
GPG / PGP translat,PGP/GPG
EASY 4096 PGP (Step by Step Guide),PGP/GPG
P.G.P ugh,PGP/GPG
Expired PGP Key (account lock out)[FIXED],PGP/GPG
PGP for Mac Tutorial :D ,PGP/GPG
PGP Questions,PGP/GPG
PGP,PGP/GPG
Getting error on decrypting a pgp,PGP/GPG
Mailing PGP,PGP/GPG
(Highly Recomended) Do not use AutoPGP,PGP/GPG
Vendor issues retrieving PGP key,PGP/GPG
Help signing pgp message,PGP/GPG
Lost private key,PGP/GPG
PGP for messaging,PGP/GPG
How to get PGP?,PGP/GPG
PGP Key keeps spacing.....help,PGP/GPG
Reading PGP on raspberry Pi,PGP/GPG
Security of using BMR PM encryption vs. your own.,PGP/GPG
Complete Beginner in Learning pgp and Need Help,PGP/GPG
pgp question,PGP/GPG
pgp test,PGP/GPG
Vendors - Pimp your PGP key,PGP/GPG
Not encrypted!?!?!?!,PGP/GPG
BMR encryption,PGP/GPG
"NSA's 512-qubit 'Skynet' quantum computer, how safe is encryption?",PGP/GPG
How do you encrypt a usb stick?,PGP/GPG
"<3.pm - heart.pm webbased, end2end encrypted messaging tool",PGP/GPG
Full disk encryption in Ubuntu?,PGP/GPG
pls help me  with public key.. i want to prove its myself !!,PGP/GPG
Auto PGP encryption,PGP/GPG
Can sombody help me learn to do PGP with Tails ?,PGP/GPG
help!! I need private keys from pgp4win,PGP/GPG
Tails Vs TrueCrypt pls help me : (,PGP/GPG
PGP for windows guide,PGP/GPG
Integrated PGP server side or client?,PGP/GPG
TrueCrypt Compromisable by Governments?,PGP/GPG
PGP Practice,PGP/GPG
PGP Problems,PGP/GPG
trouble decrypting PGP from bungee admins,PGP/GPG
Repost from Back Flag user Apotheosis on PGP keys,PGP/GPG
Encrypting a USB drive,PGP/GPG
French TrueCrypt Tutorial,PGP/GPG
Can a PGP passphrase stop working?,PGP/GPG
PGP help needed! ,PGP/GPG
Issues using the APG version of PGP,PGP/GPG
Need PGP help please,PGP/GPG
Word of Warning -- All versions of PGP are NOT created equal,PGP/GPG
BestCrypt Volume Encryption,PGP/GPG
TrueCrypt has been compromised,PGP/GPG
Recovery of PGP Passphrase?,PGP/GPG
LE possibly trying to match me to my past vendor account with PGP,PGP/GPG
PGP on a iphone,PGP/GPG
pgp issue,PGP/GPG
Place your PGP here and link to it in your sig!,PGP/GPG
Must I share my PGP key with other if I wanna send him an encrypted?,PGP/GPG
pgp error?,PGP/GPG
Problem setting up Pgp on evo profile page,PGP/GPG
How do I encyrpt/decrypt msgs on Tails?,PGP/GPG
TrueCrypt development has ended 05/28/14,PGP/GPG
How to import my pgp key?,PGP/GPG
anonymity - privnote - encryption,PGP/GPG
I can't decrypt vendor's message,PGP/GPG
Encrypt & Decrypt AES Source Code,PGP/GPG
