Product Name,New Code   
HOW TO SHIP MARIJUANA AND NOT GET CAUGHT                                ,Transportation/Stealth
Guide To Postal Smuggling                                               ,Transportation/Stealth
Guide To Postal Smuggling                                               ,Transportation/Stealth
POSTAL SMUGGLING - Concealment Methods                                  ,Transportation/Stealth
How to Ship Drugs in the Mail (USPS)                                    ,Transportation/Stealth
Guide to Postal Smuggiling Make the USPS Work for YOU                   ,Transportation/Stealth
Guide To postal Smuggling                                               ,Transportation/Stealth
Guide To Postal Smuggling                                               ,Transportation/Stealth
Guide To Postal Smuggling                                               ,Transportation/Stealth
HOW TO SHIP DRUGS or GUNS STEALTH V.2                                   ,Transportation/Stealth
HOW TO SHIP DRUGS STEALTHY - TUTORIALS AND VIDEO                        ,Transportation/Stealth
HOW TO SHIP DRUGS STEALTHY - TUTORIALS AND VIDEO                        ,Transportation/Stealth
Guide to Postal Smuggling eBook                                         ,Transportation/Stealth
How to Ship Safely Super Pack ($20 Pack)                                ,Transportation/Stealth
GUIDE TO POSTAL SMUGGLING                                               ,Transportation/Stealth
How to extract cocaine from Paper or Paperboard                         ,Transportation/Stealth
POSTAL SMUGGLING - Concealment Methods                                  ,Transportation/Stealth
Guide To postal Smuggling                                               ,Transportation/Stealth
How to Ship Safely Super Pack ($10 Pack)                                ,Transportation/Stealth
HOW TO SHIP MARIJUANA AND NOT GET CAUGHT                                ,Transportation/Stealth
How to Ship Drugs in the Mail (USPS)                                    ,Transportation/Stealth
Guide to Postal Smuggiling Make the USPS Work for YOU                   ,Transportation/Stealth
Guide to Postal Smuggling eBook                                         ,Transportation/Stealth
HOW TO SHIP MARIJUANA AND NOT GET CAUGHT                                ,Transportation/Stealth
POSTAL SMUGGLING - Concealment Methods                                  ,Transportation/Stealth
Ultimate Postal Smuggling Concealment Never Lose Parcel                 ,Transportation/Stealth
Ultimate Postal Smuggling Concealment Never Lose Parcel                 ,Transportation/Stealth
Stealth Phone                                                           ,Transportation/Stealth
Receiving Packages Safely                                               ,Transportation/Stealth
picking up package at post office                                       ,Transportation/Stealth
My package is @ the USJFCOM in VA IS THIS NORMAL?!                      ,Transportation/Stealth
Deleting identifying information after product has been shipped.        ,Transportation/Stealth
Shipping question                                                       ,Transportation/Stealth
Shipping Schedule                                                       ,Transportation/Stealth
Clear address for buying?                                               ,Transportation/Stealth
address mail for the darknet                                            ,Transportation/Stealth
Shipping Schedule                                                       ,Transportation/Stealth
Shipping question                                                       ,Transportation/Stealth
please advice me for method of send the package                         ,Transportation/Stealth
How to beat a controlled delivery!! MUST READ!!!                        ,Transportation/Stealth
amazon gift cards - how do you mail the actual goods to yourself?       ,Transportation/Stealth
High risk countries to import from?                                     ,Transportation/Stealth
Delivery Options                                                        ,Transportation/Stealth
picking up package at post office                                       ,Transportation/Stealth
Shipping Schedule,Transportation/Stealth
Shipping question,Transportation/Stealth
please advice me for method of send the package,Transportation/Stealth
How to beat a controlled delivery!! MUST READ!!!,Transportation/Stealth
amazon gift cards - how do you mail the actual goods to yourself?,Transportation/Stealth
High risk countries to import from?,Transportation/Stealth
Delivery Options,Transportation/Stealth
picking up package at post office,Transportation/Stealth
Using Home Address,Transportation/Stealth
"Help, received an empty envelope!",Transportation/Stealth
Receiving Packages Safely ,Transportation/Stealth
The use of a PMB(Private Mailbox) in a friends name? Tips etc?,Transportation/Stealth
The Art of Smuggling (OVDB Production),Transportation/Stealth
Deleting identifying information after product has been shipped.,Transportation/Stealth
Canadian Postage Unmarked stamps...,Transportation/Stealth
Profiling postal packages VENDORS MUST READ,Transportation/Stealth
Stealth Phone,Transportation/Stealth
Mail Forwarding services,Transportation/Stealth
Getting CF delivered safely,Transportation/Stealth
Need help printing postage online,Transportation/Stealth
Police postal,Transportation/Stealth
Pot Candy in the Mail,Transportation/Stealth
Shipping/Customs,Transportation/Stealth
What will Canada Customs (and others) do with a seized drug package?,Transportation/Stealth
Best Way To Recieve A Package In Australia?,Transportation/Stealth
Orders not arriving. Need advice!,Transportation/Stealth
Shipping drugs to a drop?,Transportation/Stealth
"packages seized, should i be concerned",Transportation/Stealth
Drop for amazon neccesary?,Transportation/Stealth
Australian Mail Drop Guide,Transportation/Stealth
Container45158 Anonymous U.S.A Drop Method/Exploit,Transportation/Stealth
Receiving a package safely ???,Transportation/Stealth
Australian Mail Drop Guide UPDATED 1.2,Transportation/Stealth
GET YOUR OWN ITEM/MAIL DROP TUTORIAL:USA UK EU INTERNATIONAL,Transportation/Stealth
Did my package get seized?,Transportation/Stealth
Best place to keep your drug stash,Transportation/Stealth
{VOUCHED}****New Drop Guide**** (Fresh Idea),Transportation/Stealth
question about drop,Transportation/Stealth
USPS wants me to sign to pick up a package,Transportation/Stealth
[GUIDE] - How to get a UK drop for Letters & Parcels,Transportation/Stealth
"Unlimited Drops, and of course the Best Drops",Transportation/Stealth
Drop Setup: Questions and Ideas,Transportation/Stealth
How to ship anonymously recorded items UK,Transportation/Stealth
Is it safe to order to your home address?,Transportation/Stealth
"caught by the cops and now being watched, advise???",Transportation/Stealth
AUS International Orders,Transportation/Stealth
Anti-interception phones .... really ?,Transportation/Stealth
Dangerous lot number in Moisture barrier bags?,Transportation/Stealth
How do you make your parcels stealthier? (weed),Transportation/Stealth
Seizure letter then helicopters. Being paranoid?,Transportation/Stealth
★ ★ ★NEW way to have an anonymous drop point 2015★ ★ ★,Transportation/Stealth
How do I send mail with a fake return address?,Transportation/Stealth
"Received empty box from ""reputable"" vendor, refusing to refund/reship",Transportation/Stealth
UK receiving parcels,Transportation/Stealth
"Customs holding package , freak out or not ?",Transportation/Stealth
Best DROP IDEA IN YEARS Works anywhere. Unlimited drops. . free. SAFE,Transportation/Stealth
US Mail Document Drop?,Transportation/Stealth
Australian Drops Guide,Transportation/Stealth
